weekday,month,date,year,text,handle,comment_unclean,service_person,comment
Thu,Oct,1,2015,@mjdout I know that can be frustrating..we hope to have you parked and deplaned shortly. Thanks for your patience.  *AA,@mjdout  ,I know that can be frustrating..we hope to have you parked and deplaned shortly. Thanks for your patience.  *AA,AA,I know that can be frustrating..we hope to have you parked and deplaned shortly. Thanks for your patience.  
Thu,Oct,1,2015,"@rmarkerm Terribly sorry for the inconvenience. If we can be of assistance at this time, pls let us know.  *AA",@rmarkerm  ,"Terribly sorry for the inconvenience. If we can be of assistance at this time, pls let us know.  *AA",AA,"Terribly sorry for the inconvenience. If we can be of assistance at this time, pls let us know.  "
Thu,Oct,1,2015,"@checho85  I can check, pls follow and DM your confirmation # for review.  *AA",@checho85  ," I can check, pls follow and DM your confirmation # for review.  *AA",AA," I can check, pls follow and DM your confirmation # for review.  "
Thu,Oct,1,2015,"@nealaa ...Alerts, pls check here: http://t.co/0jlcZnT95Q *JH ",@nealaa  ,"...Alerts, pls check here: http://t.co/0jlcZnT95Q *JH ",JH ,"...Alerts, pls check here: http://t.co/0jlcZnT95Q "
Thu,Oct,1,2015,"@nealaa ...advisory has only been issued for the Bahamas, but that could change.  To check for updates on Weather advisories &amp;... ",@nealaa  ,"...advisory has only been issued for the Bahamas, but that could change.  To check for updates on Weather advisories &amp;... ",,"...advisory has only been issued for the Bahamas, but that could change.  To check for updates on Weather advisories &amp;... "
Thu,Oct,1,2015,@nealaa Hi. Our meteorologist team is aware of Hurricane Joaquin &amp; monitors weather conditions at all times. At this time a weather... ,@nealaa  ,Hi. Our meteorologist team is aware of Hurricane Joaquin &amp; monitors weather conditions at all times. At this time a weather... ,,Hi. Our meteorologist team is aware of Hurricane Joaquin &amp; monitors weather conditions at all times. At this time a weather... 
Thu,Oct,1,2015,@BigGucciQueen  This is your direct dial number + 43 (0)1 360 277 3461. *DD,@BigGucciQueen  , This is your direct dial number + 43 (0)1 360 277 3461. *DD,DD, This is your direct dial number + 43 (0)1 360 277 3461. 
Thu,Oct,1,2015,@marxypoo ...for any inconvenience.  *JH ,@marxypoo  ,...for any inconvenience.  *JH ,JH ,...for any inconvenience.  
Thu,Oct,1,2015,@marxypoo ...the system &amp; when you are ready to board the aircraft the correct seat assignment will be given to you. My apologies... ,@marxypoo  ,...the system &amp; when you are ready to board the aircraft the correct seat assignment will be given to you. My apologies... ,,...the system &amp; when you are ready to board the aircraft the correct seat assignment will be given to you. My apologies... 
Thu,Oct,1,2015,"@marxypoo Hi Marx. This is a known issue &amp; our IT team members are working on a fix. Be assured, once you make the change it is in... ",@marxypoo  ,"Hi Marx. This is a known issue &amp; our IT team members are working on a fix. Be assured, once you make the change it is in... ",,"Hi Marx. This is a known issue &amp; our IT team members are working on a fix. Be assured, once you make the change it is in... "
Thu,Oct,1,2015,@BigGucciQueen  What country are you calling from? *DD,@BigGucciQueen  , What country are you calling from? *DD,DD, What country are you calling from? 
Thu,Oct,1,2015,@DaneLopes Congratulations! Thank you for your loyalty. :) *DD,@DaneLopes  ,Congratulations! Thank you for your loyalty. :) *DD,DD,Congratulations! Thank you for your loyalty. :) 
Thu,Oct,1,2015,@jwatt44 Hello Jana. What flight are you referring to?  *RD,@jwatt44  ,Hello Jana. What flight are you referring to?  *RD,RD,Hello Jana. What flight are you referring to?  
Thu,Oct,1,2015,@bar_right ...will be glad to work with you regarding any issues. My apologies for the service. *JH ,@bar_right  ,...will be glad to work with you regarding any issues. My apologies for the service. *JH ,JH ,...will be glad to work with you regarding any issues. My apologies for the service. 
Thu,Oct,1,2015,@bar_right Hi Pete. That is not good to hear. For questions or comments regarding the wifi service pls tweet @Gogo. A team member... ,@bar_right  ,Hi Pete. That is not good to hear. For questions or comments regarding the wifi service pls tweet @Gogo. A team member... ,,Hi Pete. That is not good to hear. For questions or comments regarding the wifi service pls tweet @Gogo. A team member... 
Thu,Oct,1,2015,"@Artistsupporter I think other people might need his services, but I'm sure he'll appreciate the sentiment! *WG",@Artistsupporter  ,"I think other people might need his services, but I'm sure he'll appreciate the sentiment! *WG",WG,"I think other people might need his services, but I'm sure he'll appreciate the sentiment! "
Thu,Oct,1,2015,"@Frank_Schlegel It may take several weeks to get a response, so if you sent it not too long ago, please give them more time. *WG",@Frank_Schlegel  ,"It may take several weeks to get a response, so if you sent it not too long ago, please give them more time. *WG",WG,"It may take several weeks to get a response, so if you sent it not too long ago, please give them more time. "
Thu,Oct,1,2015,@gim_esther Sorry to hear Esther. I will cancel your flights for you. *NG,@gim_esther  ,Sorry to hear Esther. I will cancel your flights for you. *NG,NG,Sorry to hear Esther. I will cancel your flights for you. 
Thu,Oct,1,2015,"@saragoldrickrab even in a small way, during this difficult time. *AB",@saragoldrickrab  ,"even in a small way, during this difficult time. *AB",AB,"even in a small way, during this difficult time. "
Thu,Oct,1,2015,"@saragoldrickrab My sincere condolences, Sara. I'm glad to hear we were able to be there, (cont) *AB",@saragoldrickrab  ,"My sincere condolences, Sara. I'm glad to hear we were able to be there, (cont) *AB",AB,"My sincere condolences, Sara. I'm glad to hear we were able to be there, (cont) "
Thu,Oct,1,2015,@Dirtyone23 Thanks for letting us be your ride Joe. Happy Travels! :-) *NG,@Dirtyone23  ,Thanks for letting us be your ride Joe. Happy Travels! :-) *NG,NG,Thanks for letting us be your ride Joe. Happy Travels! :-) 
Thu,Oct,1,2015,@papapaintvids Sorry to hear.  Pls follow/DM your confirmation # and I'll take a look to see what's on going on. *NG,@papapaintvids  ,Sorry to hear.  Pls follow/DM your confirmation # and I'll take a look to see what's on going on. *NG,NG,Sorry to hear.  Pls follow/DM your confirmation # and I'll take a look to see what's on going on. 
Thu,Oct,1,2015,@iamdonovan Hi! Please DM your Delta ticket or confirmation number. I will check for the AZ confirmation number.  *MR,@iamdonovan  ,Hi! Please DM your Delta ticket or confirmation number. I will check for the AZ confirmation number.  *MR,MR,Hi! Please DM your Delta ticket or confirmation number. I will check for the AZ confirmation number.  
Thu,Oct,1,2015,@i_am_rao  Great! I'm not sure. I will report the glitch. *DD,@i_am_rao  , Great! I'm not sure. I will report the glitch. *DD,DD, Great! I'm not sure. I will report the glitch. 
Thu,Oct,1,2015,@Sam_L_Shead Got it. Feel free to tweet us anytime. *NG,@Sam_L_Shead  ,Got it. Feel free to tweet us anytime. *NG,NG,Got it. Feel free to tweet us anytime. 
Thu,Oct,1,2015,@Sam_L_Shead So sorry to hear Sam. Pls follow/DM your confirmation # if rebooking assistance is needed. *NG,@Sam_L_Shead  ,So sorry to hear Sam. Pls follow/DM your confirmation # if rebooking assistance is needed. *NG,NG,So sorry to hear Sam. Pls follow/DM your confirmation # if rebooking assistance is needed. 
Thu,Oct,1,2015,@jovenitti I'm afraid they're all sold out.  *NG,@jovenitti  ,I'm afraid they're all sold out.  *NG,NG,I'm afraid they're all sold out.  
Thu,Oct,1,2015,@i_am_rao You may wish to speak with our Online team at 888 750 3284 for assistance. *DD,@i_am_rao  ,You may wish to speak with our Online team at 888 750 3284 for assistance. *DD,DD,You may wish to speak with our Online team at 888 750 3284 for assistance. 
Thu,Oct,1,2015,"@jovenitti Sorry we don't have that option.. For a mileage upgrade, you'll need to contact the mileage desk at the # provided. *NG",@jovenitti  ,"Sorry we don't have that option.. For a mileage upgrade, you'll need to contact the mileage desk at the # provided. *NG",NG,"Sorry we don't have that option.. For a mileage upgrade, you'll need to contact the mileage desk at the # provided. "
Thu,Oct,1,2015,@jovenitti Were you looking to use a certificate? *NG,@jovenitti  ,Were you looking to use a certificate? *NG,NG,Were you looking to use a certificate? 
Thu,Oct,1,2015,@jovenitti ...*NG ,@joveni,...*NG ,NG ,...
Thu,Oct,1,2015,@jovenitti ...collect credit card info via Twitter. You may wish to contact our Sales Team at +31 (0)20 721 9128 for assistance.... ,@jovenitti  ,...collect credit card info via Twitter. You may wish to contact our Sales Team at +31 (0)20 721 9128 for assistance.... ,,...collect credit card info via Twitter. You may wish to contact our Sales Team at +31 (0)20 721 9128 for assistance.... 
Thu,Oct,1,2015,@jovenitti Hi Tony. You may incur a fee and difference in fare to make this change. Unfortunately we're unable to quote fares or... ,@jovenitti  ,Hi Tony. You may incur a fee and difference in fare to make this change. Unfortunately we're unable to quote fares or... ,,Hi Tony. You may incur a fee and difference in fare to make this change. Unfortunately we're unable to quote fares or... 
Thu,Oct,1,2015,"@patrickhaiem No, you'll be vetted for each flight. PreCheck is not a guarantee, however, the KTN increases your chances.  *AA",@patrickhaiem  ,"No, you'll be vetted for each flight. PreCheck is not a guarantee, however, the KTN increases your chances.  *AA",AA,"No, you'll be vetted for each flight. PreCheck is not a guarantee, however, the KTN increases your chances.  "
Thu,Oct,1,2015,@patrickhaiem ...this flight and you'll need to clear security as normal.  *AA ,@patrickhaiem  ,...this flight and you'll need to clear security as normal.  *AA ,AA ,...this flight and you'll need to clear security as normal.  
Thu,Oct,1,2015,"@patrickhaiem The KTN is already apart of your profile, if TSA PreCheck is not on your boarding pass, TSA has not cleared you for... ",@patrickhaiem  ,"The KTN is already apart of your profile, if TSA PreCheck is not on your boarding pass, TSA has not cleared you for... ",,"The KTN is already apart of your profile, if TSA PreCheck is not on your boarding pass, TSA has not cleared you for... "
Thu,Oct,1,2015,@drkkyu Sorry to hear. I'll be sure to pass this feedback along to our Rates and Fares Team. My condolences on your loss. *NG,@drkkyu  ,Sorry to hear. I'll be sure to pass this feedback along to our Rates and Fares Team. My condolences on your loss. *NG,NG,Sorry to hear. I'll be sure to pass this feedback along to our Rates and Fares Team. My condolences on your loss. 
Thu,Oct,1,2015,@DontDroptheZoap  Thank you and have a wonderful day! *MR,@DontDroptheZoap  , Thank you and have a wonderful day! *MR,MR, Thank you and have a wonderful day! 
Thu,Oct,1,2015,@mglacey You may want to clear your cache. This may help. If this doesn't work let us know. *AB,@mglacey  ,You may want to clear your cache. This may help. If this doesn't work let us know. *AB,AB,You may want to clear your cache. This may help. If this doesn't work let us know. 
Thu,Oct,1,2015,"@daniellecalder  Danielle, so sorry to hear you're having a problem booking on our website.  Please contact our Online Support Desk... ",@daniellecalder  ," Danielle, so sorry to hear you're having a problem booking on our website.  Please contact our Online Support Desk... ",," Danielle, so sorry to hear you're having a problem booking on our website.  Please contact our Online Support Desk... "
Thu,Oct,1,2015,@daniellecalder ...at 1-888-750-3284. *BB ,@daniellecalder  ,...at 1-888-750-3284. *BB ,BB ,...at 1-888-750-3284. 
Thu,Oct,1,2015,@mglacey One more question. Are you trying to book via the App? *AB,@mglacey  ,One more question. Are you trying to book via the App? *AB,AB,One more question. Are you trying to book via the App? 
Thu,Oct,1,2015,"@MollyChisamore  Molly, our apologies we will do our best to get you on your way as quickly as possible.  *KM",@MollyChisamore  ," Molly, our apologies we will do our best to get you on your way as quickly as possible.  *KM",KM," Molly, our apologies we will do our best to get you on your way as quickly as possible.  "
Thu,Oct,1,2015,@zdlatham  Sorry about that! Please follow/DM your confirm #. *KM,@zdlatham  , Sorry about that! Please follow/DM your confirm #. *KM,KM, Sorry about that! Please follow/DM your confirm #. 
Thu,Oct,1,2015,"@davidcooperlive Happy travels, David! :-) *AB",@davidcooperlive  ,"Happy travels, David! :-) *AB",AB,"Happy travels, David! :-) "
Thu,Oct,1,2015,"@jasonallen50 That’s not good to hear, Jason. Please follow/DM if I can be of any assistance. Thanks. *AB",@jasonallen50  ,"That’s not good to hear, Jason. Please follow/DM if I can be of any assistance. Thanks. *AB",AB,"That’s not good to hear, Jason. Please follow/DM if I can be of any assistance. Thanks. "
Thu,Oct,1,2015,"@roryscovel Rory, sorry for the inconvenience! Pls follow/DM your confirm #. *KM",@roryscovel  ,"Rory, sorry for the inconvenience! Pls follow/DM your confirm #. *KM",KM,"Rory, sorry for the inconvenience! Pls follow/DM your confirm #. "
Thu,Oct,1,2015,"@mglacey Hi, Mitch. We haven't received any complaints up until now. Have you tried calling Online Support at 888-750-3284? *AB",@mglacey  ,"Hi, Mitch. We haven't received any complaints up until now. Have you tried calling Online Support at 888-750-3284? *AB",AB,"Hi, Mitch. We haven't received any complaints up until now. Have you tried calling Online Support at 888-750-3284? "
Thu,Oct,1,2015,"@lanaandlovely  For future reference, we do have fare options that are fully refundable and changeable.  *KC",@lanaandlovely  ," For future reference, we do have fare options that are fully refundable and changeable.  *KC",KC," For future reference, we do have fare options that are fully refundable and changeable.  "
Thu,Oct,1,2015,@lanaandlovely  We're sorry for your displeasure with our administrative change fee. *KC,@lanaandlovely  , We're sorry for your displeasure with our administrative change fee. *KC,KC, We're sorry for your displeasure with our administrative change fee. 
Thu,Oct,1,2015,"@classyhoney My apologies, April. Please let me know if I can be of any assistance. Thanks. *AB",@classyhoney  ,"My apologies, April. Please let me know if I can be of any assistance. Thanks. *AB",AB,"My apologies, April. Please let me know if I can be of any assistance. Thanks. "
Thu,Oct,1,2015,@codered45 ...will try to make this right. *BB ,@codered45  ,...will try to make this right. *BB ,BB ,...will try to make this right. 
Thu,Oct,1,2015,"@codered45  Cody, I apologize that your day was spent in the airport and not your destination.  Please DM your confirmation and I... ",@codered45  ," Cody, I apologize that your day was spent in the airport and not your destination.  Please DM your confirmation and I... ",," Cody, I apologize that your day was spent in the airport and not your destination.  Please DM your confirmation and I... "
Thu,Oct,1,2015,"@sandrareed I certainly will, Sandra. I have sent a message to ATL Leadership. Thanks for sharing your great experience with us! :-) *AB",@sandrareed  ,"I certainly will, Sandra. I have sent a message to ATL Leadership. Thanks for sharing your great experience with us! :-) *AB",AB,"I certainly will, Sandra. I have sent a message to ATL Leadership. Thanks for sharing your great experience with us! :-) "
Thu,Oct,1,2015,@WinshipAtEmory Nice ad! Glad to be able to contribute for such a great cause.  *TH,@WinshipAtEmory  ,Nice ad! Glad to be able to contribute for such a great cause.  *TH,TH,Nice ad! Glad to be able to contribute for such a great cause.  
Thu,Oct,1,2015,"@blipvert23 Hi Maxine, that's not good to hear. Pls follow/DM your confirmation # so I can take a look. *KC",@blipvert23  ,"Hi Maxine, that's not good to hear. Pls follow/DM your confirmation # so I can take a look. *KC",KC,"Hi Maxine, that's not good to hear. Pls follow/DM your confirmation # so I can take a look. "
Thu,Oct,1,2015,"@mdd1911 Hey Marcus, the blue light looks cool on you! Enjoy the ride! *KM",@mdd1911  ,"Hey Marcus, the blue light looks cool on you! Enjoy the ride! *KM",KM,"Hey Marcus, the blue light looks cool on you! Enjoy the ride! "
Thu,Oct,1,2015,@aubreigh_dash You're welcome! Happy Travels! *JH,@aubreigh_dash  ,You're welcome! Happy Travels! *JH,JH,You're welcome! Happy Travels! 
Thu,Oct,1,2015,"@hclark18P If you wish to use your miles to book a flight for someone else, you may:) *RB",@hclark18P  ,"If you wish to use your miles to book a flight for someone else, you may:) *RB",RB,"If you wish to use your miles to book a flight for someone else, you may:) "
Thu,Oct,1,2015,@MLRitch Hello Mende. Not good to hear. Pls follow/DM your confirm # for your privacy.  *RD,@MLRitch  ,Hello Mende. Not good to hear. Pls follow/DM your confirm # for your privacy.  *RD,RD,Hello Mende. Not good to hear. Pls follow/DM your confirm # for your privacy.  
Thu,Oct,1,2015,@INAYADAY We sincerely apologize. We hate goodbyes. Please let us know if there is anything we could do to further assist. *KC,@INAYADAY  ,We sincerely apologize. We hate goodbyes. Please let us know if there is anything we could do to further assist. *KC,KC,We sincerely apologize. We hate goodbyes. Please let us know if there is anything we could do to further assist. 
Thu,Oct,1,2015,@kitmoni At the moment there appears to be a a delay of slightly over an hour. My apologies for today's experience with us.  *RB,@kitmoni  ,At the moment there appears to be a a delay of slightly over an hour. My apologies for today's experience with us.  *RB,RB,At the moment there appears to be a a delay of slightly over an hour. My apologies for today's experience with us.  
Thu,Oct,1,2015,@D0llabillwill ...with her or direct her in the right direction. *JH ,@D0llabillwill  ,...with her or direct her in the right direction. *JH ,JH ,...with her or direct her in the right direction. 
Thu,Oct,1,2015,@D0llabillwill ...her check with the Delta airport Red coat Specialist for assistance. A team member will do their best to work... ,@D0llabillwill  ,...her check with the Delta airport Red coat Specialist for assistance. A team member will do their best to work... ,,...her check with the Delta airport Red coat Specialist for assistance. A team member will do their best to work... 
Thu,Oct,1,2015,@D0llabillwill Hi. I'm sorry to hear that she did not clear standby. She will automatically be moved over to the next flt. Pls have... ,@D0llabillwill  ,Hi. I'm sorry to hear that she did not clear standby. She will automatically be moved over to the next flt. Pls have... ,,Hi. I'm sorry to hear that she did not clear standby. She will automatically be moved over to the next flt. Pls have... 
Thu,Oct,1,2015,@Mutiny32 ..DM your confirmation number and I'll take a look. *KC,@Mutiny32  ,..DM your confirmation number and I'll take a look. *KC,KC,..DM your confirmation number and I'll take a look. 
Thu,Oct,1,2015,@Mutiny32 Hi. We apologize for any inconvenience the schedule change as caused. Please  *KC,@Mutiny32  ,Hi. We apologize for any inconvenience the schedule change as caused. Please  *KC,KC,Hi. We apologize for any inconvenience the schedule change as caused. Please  
Thu,Oct,1,2015,@seanangus11 At the moment I don't have that information. You may wish to check back with us on 10/3.  *RB,@seanangus11  ,At the moment I don't have that information. You may wish to check back with us on 10/3.  *RB,RB,At the moment I don't have that information. You may wish to check back with us on 10/3.  
Thu,Oct,1,2015,"@kitmoni My apologies, Mr. Connelly. I have just alerted the station manager. You should be receiving help shortly.  *RB",@kitmoni  ,"My apologies, Mr. Connelly. I have just alerted the station manager. You should be receiving help shortly.  *RB",RB,"My apologies, Mr. Connelly. I have just alerted the station manager. You should be receiving help shortly.  "
Thu,Oct,1,2015,@idosela Not happy to hear this at all! Can you follow/DM your confirm #? *KM,@idosela  ,Not happy to hear this at all! Can you follow/DM your confirm #? *KM,KM,Not happy to hear this at all! Can you follow/DM your confirm #? 
Thu,Oct,1,2015,@jeffbuehrle Thanks so much. So sorry for the inconvenience. *SD,@jeffbuehrle  ,Thanks so much. So sorry for the inconvenience. *SD,SD,Thanks so much. So sorry for the inconvenience. 
Thu,Oct,1,2015,@EugeniaMorato Unfortunately we are not equipped to quote fares via DM. They will be happy to help.  *RB,@EugeniaMorato  ,Unfortunately we are not equipped to quote fares via DM. They will be happy to help.  *RB,RB,Unfortunately we are not equipped to quote fares via DM. They will be happy to help.  
Thu,Oct,1,2015,@jeffbuehrle Hi Jeff. Thanks so much for sharing your feedback regarding your recent experience. We will definitely look into this.  *SD,@jeffbuehrle  ,Hi Jeff. Thanks so much for sharing your feedback regarding your recent experience. We will definitely look into this.  *SD,SD,Hi Jeff. Thanks so much for sharing your feedback regarding your recent experience. We will definitely look into this.  
Thu,Oct,1,2015,@JohnDayAtl You may wish to reach out to a flight attendant for alternate seating options. *KC,@JohnDayAtl  ,You may wish to reach out to a flight attendant for alternate seating options. *KC,KC,You may wish to reach out to a flight attendant for alternate seating options. 
Thu,Oct,1,2015,"@JohnDayAtl Hi John, We apologize for any discomfort you are experiencing.  *KC",@JohnDayAtl  ,"Hi John, We apologize for any discomfort you are experiencing.  *KC",KC,"Hi John, We apologize for any discomfort you are experiencing.  "
Thu,Oct,1,2015,@iwoolery Pls follow/DM your confirm # for your privacy. Let me check your Reservation.  *RD,@iwoolery  ,Pls follow/DM your confirm # for your privacy. Let me check your Reservation.  *RD,RD,Pls follow/DM your confirm # for your privacy. Let me check your Reservation.  
Thu,Oct,1,2015,"@GreenLeann Hi Leann. Yes, you are subject to a cancellation fee.  *SD",@GreenLeann  ,"Hi Leann. Yes, you are subject to a cancellation fee.  *SD",SD,"Hi Leann. Yes, you are subject to a cancellation fee.  "
Fri,Oct,2,2015,@Judith_Hill Great to hear Judith! Thanks for letting us be your ride. :-) *NG,@Judith_Hill  ,Great to hear Judith! Thanks for letting us be your ride. :-) *NG,NG,Great to hear Judith! Thanks for letting us be your ride. :-) 
Fri,Oct,2,2015,@melaright We hope you change your mind in the future. You are welcome.  *RD,@melaright  ,We hope you change your mind in the future. You are welcome.  *RD,RD,We hope you change your mind in the future. You are welcome.  
Fri,Oct,2,2015,@usedtobehere  Hi. What's the confirmation #? *AA,@usedtobehere  , Hi. What's the confirmation #? *AA,AA, Hi. What's the confirmation #? 
Fri,Oct,2,2015,@Naterizk Yes.  *AA,@Naterizk,Yes.  *AA,AA,Yes.  
Fri,Oct,2,2015,@avitale21 What city are you traveling to and I can check specific flights.  *AA,@avitale21  ,What city are you traveling to and I can check specific flights.  *AA,AA,What city are you traveling to and I can check specific flights.  
Fri,Oct,2,2015,@wespearsnewsome ...you. *MD ,@wespearsnew,...you. *MD ,MD ,...you. 
Fri,Oct,2,2015,@wespearsnewsome I'm sorry to hear it Wes. Please follow and DM your Delta confirmation number and I will check seat availability for... ,@wespearsnewsome  ,I'm sorry to hear it Wes. Please follow and DM your Delta confirmation number and I will check seat availability for... ,,I'm sorry to hear it Wes. Please follow and DM your Delta confirmation number and I will check seat availability for... 
Fri,Oct,2,2015,"@Naterizk I can check, what's your confirmation #? *AA",@Naterizk  ,"I can check, what's your confirmation #? *AA",AA,"I can check, what's your confirmation #? "
Fri,Oct,2,2015,@meowmeowdeb  A team member will be glad to work with you regarding any issues. My apologies for the service. *DD,@meowmeowdeb  , A team member will be glad to work with you regarding any issues. My apologies for the service. *DD,DD, A team member will be glad to work with you regarding any issues. My apologies for the service. 
Fri,Oct,2,2015,@meowmeowdeb That is not good to hear. For questions or comments regarding the wifi service pls tweet @Gogo. *DD,@meowmeowdeb  ,That is not good to hear. For questions or comments regarding the wifi service pls tweet @Gogo. *DD,DD,That is not good to hear. For questions or comments regarding the wifi service pls tweet @Gogo. 
Fri,Oct,2,2015,@emilyminor2 ...benefits. So checking-in at the airport will work perfectly in your case. :) *MD ,@emilyminor2  ,...benefits. So checking-in at the airport will work perfectly in your case. :) *MD ,MD ,...benefits. So checking-in at the airport will work perfectly in your case. :) 
Fri,Oct,2,2015,"@emilyminor2 Hi, Emily. Card holders with companions on different reservation, must see airport agent to apply first bag free waiver... ",@emilyminor2  ,"Hi, Emily. Card holders with companions on different reservation, must see airport agent to apply first bag free waiver... ",,"Hi, Emily. Card holders with companions on different reservation, must see airport agent to apply first bag free waiver... "
Fri,Oct,2,2015,@Mikeyydean ...be glad to work with you regarding any issues. My apologies for the service. *MD ,@Mikeyydean  ,...be glad to work with you regarding any issues. My apologies for the service. *MD ,MD ,...be glad to work with you regarding any issues. My apologies for the service. 
