weekday,month,date,year,text,handle,comment_unclean,service_person,comment
Sun,Oct,11,2015,@fschenone I'm sorry to hear you're having trouble with checking in. It would be best to complete your check-in at the airport with... ,@fschenone  ,I'm sorry to hear you're having trouble with checking in. It would be best to complete your check-in at the airport with... ,,I'm sorry to hear you're having trouble with checking in. It would be best to complete your check-in at the airport with... 
Sun,Oct,11,2015,@ckalapala Please DM your conf #. *AB,@ckalapala  ,Please DM your conf #. *AB,AB,Please DM your conf #. 
Sun,Oct,11,2015,@ckalapala I'd be happy to check on this for you.  *AB,@ckalapala  ,I'd be happy to check on this for you.  *AB,AB,I'd be happy to check on this for you.  
Sun,Oct,11,2015,"@Always_JoJo21 I'm sorry, I cannot divulge passenger information. *AB",@Always_JoJo21  ,"I'm sorry, I cannot divulge passenger information. *AB",AB,"I'm sorry, I cannot divulge passenger information. "
Sun,Oct,11,2015,@nataliegow ...quickly and safely as possible.  *SB ,@nataliegow  ,...quickly and safely as possible.  *SB ,SB ,...quickly and safely as possible.  
Sun,Oct,11,2015,@dmull1985 Thank you. Your feedback is appreciated.  *EC,@dmull1985  ,Thank you. Your feedback is appreciated.  *EC,EC,Thank you. Your feedback is appreciated.  
Sun,Oct,11,2015,"@discothecat I apologize for the inconvenience. Please know, upgrades are based on availability as well as other factors.  *AB",@discothecat  ,"I apologize for the inconvenience. Please know, upgrades are based on availability as well as other factors.  *AB",AB,"I apologize for the inconvenience. Please know, upgrades are based on availability as well as other factors.  "
Sun,Oct,11,2015,@nisajoy ...our agents. Thanks for sharing your feedback. *SD ,@nisajoy  ,...our agents. Thanks for sharing your feedback. *SD ,SD ,...our agents. Thanks for sharing your feedback. 
Sun,Oct,11,2015,@nisajoy Hi Joy. This is pretty rough to hear. My apologies for the inconvenience and delay. Also for the rude behavior on behalf of... ,@nisajoy  ,Hi Joy. This is pretty rough to hear. My apologies for the inconvenience and delay. Also for the rude behavior on behalf of... ,,Hi Joy. This is pretty rough to hear. My apologies for the inconvenience and delay. Also for the rude behavior on behalf of... 
Sun,Oct,11,2015,@macaroniglitter I'll need the ship number for the Breast Cancer. Did you happen to get the ship number?  *EC,@macaroniglitter  ,I'll need the ship number for the Breast Cancer. Did you happen to get the ship number?  *EC,EC,I'll need the ship number for the Breast Cancer. Did you happen to get the ship number?  
Sun,Oct,11,2015,@Aj_Marshall17 ...look.  *PL ,@Aj_Marshall17,...look.  *PL ,PL ,...look.  
Sun,Oct,11,2015,@Aj_Marshall17 AJ. Are you asking to cancel your flight and be refunded. Please follow/DM your confirmation number so I can take a... ,@Aj_Marshall17  ,AJ. Are you asking to cancel your flight and be refunded. Please follow/DM your confirmation number so I can take a... ,,AJ. Are you asking to cancel your flight and be refunded. Please follow/DM your confirmation number so I can take a... 
Sun,Oct,11,2015,@CloseTheDeal Hi there. My apologies for the delayed response. Please DM your 13 digit ticket number for review. Your confirmation... ,@CloseTheDeal  ,Hi there. My apologies for the delayed response. Please DM your 13 digit ticket number for review. Your confirmation... ,,Hi there. My apologies for the delayed response. Please DM your 13 digit ticket number for review. Your confirmation... 
Sun,Oct,11,2015,@PowerCoupleLife I agree and certainly understand how that can be frustrating. Please follow/DM your confirmation number. *PL,@PowerCoupleLife  ,I agree and certainly understand how that can be frustrating. Please follow/DM your confirmation number. *PL,PL,I agree and certainly understand how that can be frustrating. Please follow/DM your confirmation number. 
Sun,Oct,11,2015,@ejanderson1098 ...Please see the link for the complaint.  http://t.co/rKwjYwO72S *PL ,@ejanderson1098  ,...Please see the link for the complaint.  http://t.co/rKwjYwO72S *PL ,PL ,...Please see the link for the complaint.  http://t.co/rKwjYwO72S 
Sun,Oct,11,2015,@ejanderson1098 I am so sorry the agents treated you that way. We expect our agents to be courteous and professional at all times.... ,@ejanderson1098  ,I am so sorry the agents treated you that way. We expect our agents to be courteous and professional at all times.... ,,I am so sorry the agents treated you that way. We expect our agents to be courteous and professional at all times.... 
Sun,Oct,11,2015,"@ZeeNickster Hello, Nick. Not good to hear. Sorry about all of this. Pls let me know how I can assist.  *RD",@ZeeNickster  ,"Hello, Nick. Not good to hear. Sorry about all of this. Pls let me know how I can assist.  *RD",RD,"Hello, Nick. Not good to hear. Sorry about all of this. Pls let me know how I can assist.  "
Sun,Oct,11,2015,@fulltimemom2013 Hello. Apologies for the delay. Pls let me know how I can assist.  *RD,@fulltimemom2013  ,Hello. Apologies for the delay. Pls let me know how I can assist.  *RD,RD,Hello. Apologies for the delay. Pls let me know how I can assist.  
Sun,Oct,11,2015,@CloseTheDeal ...code has expired.  *SD ,@CloseTheDeal  ,...code has expired.  *SD ,SD ,...code has expired.  
Sun,Oct,11,2015,"@misswish1981  Nice picture, Jennifer. #newpairofshoes #KeepClimbing!:) *RB",@misswish1981  ," Nice picture, Jennifer. #newpairofshoes #KeepClimbing!:) *RB",RB," Nice picture, Jennifer. #newpairofshoes #KeepClimbing!:) "
Sun,Oct,11,2015,@tnpuig Oh no! So sorry to hear about the delay. They are never fun. Please let me know if I can be of any assistance via Twitter.  *PL,@tnpuig  ,Oh no! So sorry to hear about the delay. They are never fun. Please let me know if I can be of any assistance via Twitter.  *PL,PL,Oh no! So sorry to hear about the delay. They are never fun. Please let me know if I can be of any assistance via Twitter.  
Sun,Oct,11,2015,@illuminayte I really wish there were more availability to offer upon your earlier arrival today.  So very sorry for the disappointment. *DR,@illuminayte  ,I really wish there were more availability to offer upon your earlier arrival today.  So very sorry for the disappointment. *DR,DR,I really wish there were more availability to offer upon your earlier arrival today.  So very sorry for the disappointment. 
Sun,Oct,11,2015,"@KristenSkiMom Kristen,that is a question you can ask TSA. *PL",@KristenSkiMom  ,"Kristen,that is a question you can ask TSA. *PL",PL,"Kristen,that is a question you can ask TSA. "
Sun,Oct,11,2015,@Aj_Marshall17 Hmm! Are you on the tarmac? So sorry to hear about this delay.  *PL,@Aj_Marshall17  ,Hmm! Are you on the tarmac? So sorry to hear about this delay.  *PL,PL,Hmm! Are you on the tarmac? So sorry to hear about this delay.  
Sun,Oct,11,2015,@dmull1985 Sorry to hear that you're disappointed with us. Pls let me know if I can assist you today.  *EC,@dmull1985  ,Sorry to hear that you're disappointed with us. Pls let me know if I can assist you today.  *EC,EC,Sorry to hear that you're disappointed with us. Pls let me know if I can assist you today.  
Mon,Oct,12,2015,"@High_Roller_Ent You can pass the issue on to Customer Care if you call 800-455-2720 between 8a &amp; 7p, Eastern time. *WG",@High_Roller_Ent  ,"You can pass the issue on to Customer Care if you call 800-455-2720 between 8a &amp; 7p, Eastern time. *WG",WG,"You can pass the issue on to Customer Care if you call 800-455-2720 between 8a &amp; 7p, Eastern time. "
Mon,Oct,12,2015,"@ericzr1124 The fare would have to go down more than the change fee, which is $200, in order to get anything back. *WG",@ericzr1124  ,"The fare would have to go down more than the change fee, which is $200, in order to get anything back. *WG",WG,"The fare would have to go down more than the change fee, which is $200, in order to get anything back. "
Mon,Oct,12,2015,@virgyfairy  I'm glad that you were helped. My apologies for it taking so long. Have a great evening!:) *RB,@virgyfairy  , I'm glad that you were helped. My apologies for it taking so long. Have a great evening!:) *RB,RB, I'm glad that you were helped. My apologies for it taking so long. Have a great evening!:) 
Mon,Oct,12,2015,@araholiday Hello Ara. Not good to hear. Apologies for the delay. Pls let me know how I can assist.  *RD,@araholiday  ,Hello Ara. Not good to hear. Apologies for the delay. Pls let me know how I can assist.  *RD,RD,Hello Ara. Not good to hear. Apologies for the delay. Pls let me know how I can assist.  
Mon,Oct,12,2015,"@RoshanPaudel While I am limited by twitter, I will be happy to assist where I can. How can I help? *RB",@RoshanPaudel  ,"While I am limited by twitter, I will be happy to assist where I can. How can I help? *RB",RB,"While I am limited by twitter, I will be happy to assist where I can. How can I help? "
Mon,Oct,12,2015,"@SovannPen Sorry to hear this, Mr. Pen. Please follow and DM your confirmation number and I will be happy to check your flight options.  *RB",@SovannPen  ,"Sorry to hear this, Mr. Pen. Please follow and DM your confirmation number and I will be happy to check your flight options.  *RB",RB,"Sorry to hear this, Mr. Pen. Please follow and DM your confirmation number and I will be happy to check your flight options.  "
Mon,Oct,12,2015,@Vegashornplayer Thank you for your loyalty Chris!  *RS,@Vegashornplayer  ,Thank you for your loyalty Chris!  *RS,RS,Thank you for your loyalty Chris!  
Mon,Oct,12,2015,@aussiegirl2208  Actually you can add a previously flown flight to your SkyMiles account up to 9 months from the completed flight.  *RB,@aussiegirl2208  , Actually you can add a previously flown flight to your SkyMiles account up to 9 months from the completed flight.  *RB,RB, Actually you can add a previously flown flight to your SkyMiles account up to 9 months from the completed flight.  
Mon,Oct,12,2015,"@ChipL5 ...Please follow and DM your confirmation number. 
 *RB ",@ChipL5  ,"...Please follow and DM your confirmation number. 
 *RB ",RB ,"...Please follow and DM your confirmation number. 
 "
Mon,Oct,12,2015,"@ChipL5 Sorry to hear of this problem, Mr. Lewis. You can reach GoGo customer service at 1-877-350-0038 or customercare@gogoair.com.... ",@ChipL5  ,"Sorry to hear of this problem, Mr. Lewis. You can reach GoGo customer service at 1-877-350-0038 or customercare@gogoair.com.... ",,"Sorry to hear of this problem, Mr. Lewis. You can reach GoGo customer service at 1-877-350-0038 or customercare@gogoair.com.... "
Mon,Oct,12,2015,@virgyfairy  I am following and listening Ms. Horne. How may I be of assistance? *RB,@virgyfairy  , I am following and listening Ms. Horne. How may I be of assistance? *RB,RB, I am following and listening Ms. Horne. How may I be of assistance? 
Mon,Oct,12,2015,@AlishaGrauso My apologies for the issues you've encountered today. Please let us know if you need help with your travels.  *EC,@AlishaGrauso  ,My apologies for the issues you've encountered today. Please let us know if you need help with your travels.  *EC,EC,My apologies for the issues you've encountered today. Please let us know if you need help with your travels.  
Mon,Oct,12,2015,@KristiBrown01 We appreciate your loyalty! Thanks for the tweet.  *EC,@KristiBrown01  ,We appreciate your loyalty! Thanks for the tweet.  *EC,EC,We appreciate your loyalty! Thanks for the tweet.  
Mon,Oct,12,2015,@g3gunter Awesome pic! Thank you for choosing Delta for your travel needs:) *RS,@g3gunter  ,Awesome pic! Thank you for choosing Delta for your travel needs:) *RS,RS,Awesome pic! Thank you for choosing Delta for your travel needs:) 
Mon,Oct,12,2015,"@22NicholasJ Glad to hear this, Mr. Johnson. Have a great beginning of the week! #KeepClimbing!:) *RB",@22NicholasJ  ,"Glad to hear this, Mr. Johnson. Have a great beginning of the week! #KeepClimbing!:) *RB",RB,"Glad to hear this, Mr. Johnson. Have a great beginning of the week! #KeepClimbing!:) "
Mon,Oct,12,2015,@OwenBrennan Thank you for your acknowledgements. I have forwarded them to the respected leadership.  *RB,@OwenBrennan  ,Thank you for your acknowledgements. I have forwarded them to the respected leadership.  *RB,RB,Thank you for your acknowledgements. I have forwarded them to the respected leadership.  
Mon,Oct,12,2015,"@DarcieMae11 The phone number is open 24hrs a day, so you can call them anytime. *WG",@DarcieMae11  ,"The phone number is open 24hrs a day, so you can call them anytime. *WG",WG,"The phone number is open 24hrs a day, so you can call them anytime. "
Mon,Oct,12,2015,"@IsmailDeveciogl Please DM the confirmation, &amp; I'll see what we have. *WG",@IsmailDeveciogl  ,"Please DM the confirmation, &amp; I'll see what we have. *WG",WG,"Please DM the confirmation, &amp; I'll see what we have. "
Mon,Oct,12,2015,@DuckhuntinDawg Not good to hear. The baggage should be out shortly.  *RD,@DuckhuntinDawg  ,Not good to hear. The baggage should be out shortly.  *RD,RD,Not good to hear. The baggage should be out shortly.  
Mon,Oct,12,2015,@IsmailDeveciogl What kind of help do you need? *WG,@IsmailDeveciogl  ,What kind of help do you need? *WG,WG,What kind of help do you need? 
Mon,Oct,12,2015,@SeanFamoso Oh no! Please accept my apology. Please visit the baggage service office and speak with an agent. *PL,@SeanFamoso  ,Oh no! Please accept my apology. Please visit the baggage service office and speak with an agent. *PL,PL,Oh no! Please accept my apology. Please visit the baggage service office and speak with an agent. 
Mon,Oct,12,2015,@ShelleyJamie ...place you on standby for the 11a flt from ATL/MIA if you'd like?  *SB ,@ShelleyJamie  ,...place you on standby for the 11a flt from ATL/MIA if you'd like?  *SB ,SB ,...place you on standby for the 11a flt from ATL/MIA if you'd like?  
Mon,Oct,12,2015,"@ShelleyJamie Since this is an Air Traffic control delay, I'm not sure how long they are holding flts out of the BNA airport. I can... ",@ShelleyJamie  ,"Since this is an Air Traffic control delay, I'm not sure how long they are holding flts out of the BNA airport. I can... ",,"Since this is an Air Traffic control delay, I'm not sure how long they are holding flts out of the BNA airport. I can... "
Mon,Oct,12,2015,@Grady91 Sweet. Happy travels!!! *VM,@Grady91  ,Sweet. Happy travels!!! *VM,VM,Sweet. Happy travels!!! 
Mon,Oct,12,2015,@Consult_Ling Hi Ling! Are you trying to purchase an upgrade?  *SB,@Consult_Ling  ,Hi Ling! Are you trying to purchase an upgrade?  *SB,SB,Hi Ling! Are you trying to purchase an upgrade?  
Mon,Oct,12,2015,"@Kyrrie_Twin Kyrrie, we offer a Risk Free refunds for issues like this. Did you contact us within 24hrs when noticed this error? *VM",@Kyrrie_Twin  ,"Kyrrie, we offer a Risk Free refunds for issues like this. Did you contact us within 24hrs when noticed this error? *VM",VM,"Kyrrie, we offer a Risk Free refunds for issues like this. Did you contact us within 24hrs when noticed this error? "
Mon,Oct,12,2015,@Ingo_Z   Our baggage team can be reached directly at 1-800-325-8224. *BB,@Ingo_Z  ,  Our baggage team can be reached directly at 1-800-325-8224. *BB,BB,  Our baggage team can be reached directly at 1-800-325-8224. 
Mon,Oct,12,2015,"@Kyrrie_Twin Kyrrie, what will the compensation be for? *VM",@Kyrrie_Twin  ,"Kyrrie, what will the compensation be for? *VM",VM,"Kyrrie, what will the compensation be for? "
Mon,Oct,12,2015,@NcSuperStar I am following. You sure can. *PL,@NcSuperStar  ,I am following. You sure can. *PL,PL,I am following. You sure can. 
Mon,Oct,12,2015,@Kyrrie_Twin ...issue. *VM ,@Kyrrie_Twin  ,...issue. *VM ,VM ,...issue. 
Mon,Oct,12,2015,@Kyrrie_Twin Pls call our online customer support team at 1-888-750-3284. A team member will be glad to work with you to resolve the... ,@Kyrrie_Twin  ,Pls call our online customer support team at 1-888-750-3284. A team member will be glad to work with you to resolve the... ,,Pls call our online customer support team at 1-888-750-3284. A team member will be glad to work with you to resolve the... 
Mon,Oct,12,2015,@schwabbyjs Fingers crossed! *VM,@schwabbyjs  ,Fingers crossed! *VM,VM,Fingers crossed! 
Mon,Oct,12,2015,@ShelleyJamie Hey Jamie! My apologies for the Air Traffic Control delay. Please let us know if rebooking assistance is needed.  *SB,@ShelleyJamie  ,Hey Jamie! My apologies for the Air Traffic Control delay. Please let us know if rebooking assistance is needed.  *SB,SB,Hey Jamie! My apologies for the Air Traffic Control delay. Please let us know if rebooking assistance is needed.  
Mon,Oct,12,2015,"@Qorne Pls call our Reservations team at 1 of our worldwide locations, here: http://t.co/xpEZNKiH6W  *VM",@Qorne  ,"Pls call our Reservations team at 1 of our worldwide locations, here: http://t.co/xpEZNKiH6W  *VM",VM,"Pls call our Reservations team at 1 of our worldwide locations, here: http://t.co/xpEZNKiH6W  "
Mon,Oct,12,2015,"@Kyrrie_Twin Kyrrie, we're not able to hold payments. Did you process the tkt yourself online or with a representative on the phone? *VM",@Kyrrie_Twin  ,"Kyrrie, we're not able to hold payments. Did you process the tkt yourself online or with a representative on the phone? *VM",VM,"Kyrrie, we're not able to hold payments. Did you process the tkt yourself online or with a representative on the phone? "
Mon,Oct,12,2015,@CFletcher3 Thanks Charles. Have a great flight.  *PL,@CFletcher3  ,Thanks Charles. Have a great flight.  *PL,PL,Thanks Charles. Have a great flight.  
Mon,Oct,12,2015,@emmyalleyne ...regarding the proper carry-on bag size. *VM ,@emmyalleyne  ,...regarding the proper carry-on bag size. *VM ,VM ,...regarding the proper carry-on bag size. 
Mon,Oct,12,2015,"@emmyalleyne ...professional &amp; offer accurate information to our passengers. Pls know, we have more details on our website... ",@emmyalleyne  ,"...professional &amp; offer accurate information to our passengers. Pls know, we have more details on our website... ",,"...professional &amp; offer accurate information to our passengers. Pls know, we have more details on our website... "
Mon,Oct,12,2015,@emmyalleyne Clearly you're frustrated by this experience with us today &amp; I apologize for that. We encourage our staff to be... ,@emmyalleyne  ,Clearly you're frustrated by this experience with us today &amp; I apologize for that. We encourage our staff to be... ,,Clearly you're frustrated by this experience with us today &amp; I apologize for that. We encourage our staff to be... 
Mon,Oct,12,2015,@KenzieB144 Got it! We are not in charge of the menu for any of the restaurants. It has nothing to do with Delta. *PL,@KenzieB144  ,Got it! We are not in charge of the menu for any of the restaurants. It has nothing to do with Delta. *PL,PL,Got it! We are not in charge of the menu for any of the restaurants. It has nothing to do with Delta. 
Mon,Oct,12,2015,@aasalim Thank you Antonio. One moment please. *CM,@aasalim  ,Thank you Antonio. One moment please. *CM,CM,Thank you Antonio. One moment please. 
Mon,Oct,12,2015,@riosportstour Oh my! My apologies for the delay. Please follow/DM your confirm # and I will take a look.  *CM,@riosportstour  ,Oh my! My apologies for the delay. Please follow/DM your confirm # and I will take a look.  *CM,CM,Oh my! My apologies for the delay. Please follow/DM your confirm # and I will take a look.  
Mon,Oct,12,2015,@dylan_burba24 ...kiosk at the airport.  *RB ,@dylan_burba24  ,...kiosk at the airport.  *RB ,RB ,...kiosk at the airport.  
Mon,Oct,12,2015,"@dylan_burba24 No worries, Mr. Burba. You can just have your confirmation # from your itinerary and print your boarding pass from a... ",@dylan_burba24  ,"No worries, Mr. Burba. You can just have your confirmation # from your itinerary and print your boarding pass from a... ",,"No worries, Mr. Burba. You can just have your confirmation # from your itinerary and print your boarding pass from a... "
Mon,Oct,12,2015,"@NinaThornsburg Nina, so sorry you feel that way your last leg home is on Alaskan Air.  *PL",@NinaThornsburg  ,"Nina, so sorry you feel that way your last leg home is on Alaskan Air.  *PL",PL,"Nina, so sorry you feel that way your last leg home is on Alaskan Air.  "
Mon,Oct,12,2015,@aasalim  Oh no! That's not good to hear. Please follow/DM your ticket # and details. *CM,@aasalim  , Oh no! That's not good to hear. Please follow/DM your ticket # and details. *CM,CM, Oh no! That's not good to hear. Please follow/DM your ticket # and details. 
Mon,Oct,12,2015,@PowrfulKatrinka Aww! So nice to be appreciated:-) *PL,@PowrfulKatrinka  ,Aww! So nice to be appreciated:-) *PL,PL,Aww! So nice to be appreciated:-) 
Mon,Oct,12,2015,@lounge_review Absolutely stunning pics. Thanks for sharing. *HW,@lounge_review  ,Absolutely stunning pics. Thanks for sharing. *HW,HW,Absolutely stunning pics. Thanks for sharing. 
Mon,Oct,12,2015,@W0GER_12 We're glad you decided to take a chance on us!  *EC,@W0GER_12  ,We're glad you decided to take a chance on us!  *EC,EC,We're glad you decided to take a chance on us!  
Mon,Oct,12,2015,@Royalsfan71 Hi Howard. I am showing DL5248 is scheduled to leave at 2pm and arrive in ATL at 443pm. *CM,@Royalsfan71  ,Hi Howard. I am showing DL5248 is scheduled to leave at 2pm and arrive in ATL at 443pm. *CM,CM,Hi Howard. I am showing DL5248 is scheduled to leave at 2pm and arrive in ATL at 443pm. 
Mon,Oct,12,2015,@PowrfulKatrinka Your feedback is greatly appreciated. Thank you. *PL,@PowrfulKatrinka  ,Your feedback is greatly appreciated. Thank you. *PL,PL,Your feedback is greatly appreciated. Thank you. 
Mon,Oct,12,2015,@ItsJacquiG Hey Jacqui! Welcome! Glad to see you! *KM,@ItsJacquiG  ,Hey Jacqui! Welcome! Glad to see you! *KM,KM,Hey Jacqui! Welcome! Glad to see you! 
Mon,Oct,12,2015,@Emily_Parker Awesome! Enjoy Emily. :) *CM,@Emily_Parker  ,Awesome! Enjoy Emily. :) *CM,CM,Awesome! Enjoy Emily. :) 
Mon,Oct,12,2015,"@tubelkain Travis, I hear you. That's a long time! Pls Follow &amp; DM your confirmation# *VM",@tubelkain  ,"Travis, I hear you. That's a long time! Pls Follow &amp; DM your confirmation# *VM",VM,"Travis, I hear you. That's a long time! Pls Follow &amp; DM your confirmation# "
Mon,Oct,12,2015,@JillGwaltney ...compensation options.  *PL ,@JillGwaltney  ,...compensation options.  *PL ,PL ,...compensation options.  
Mon,Oct,12,2015,"@JillGwaltney Jill, please reach back out to us when your travel is complete so we can discuss your travel experience and... ",@JillGwaltney  ,"Jill, please reach back out to us when your travel is complete so we can discuss your travel experience and... ",,"Jill, please reach back out to us when your travel is complete so we can discuss your travel experience and... "
Mon,Oct,12,2015,@rachnanivas Thanks for the kind words. Have an awesome birthday! *EC,@rachnanivas  ,Thanks for the kind words. Have an awesome birthday! *EC,EC,Thanks for the kind words. Have an awesome birthday! 
Mon,Oct,12,2015,@JonathanAllyn Please contact an agent at 800-455-2720 for assistance.  *PL,@JonathanAllyn  ,Please contact an agent at 800-455-2720 for assistance.  *PL,PL,Please contact an agent at 800-455-2720 for assistance.  
Mon,Oct,12,2015,"@tubelkain Travis, please disregard that, another pax *VM",@tubelkain  ,"Travis, please disregard that, another pax *VM",VM,"Travis, please disregard that, another pax "
Mon,Oct,12,2015,"@NinaThornsburg Nina, you can certainly reach out to a flight attendant and have them moved you to a better seat. *PL",@NinaThornsburg  ,"Nina, you can certainly reach out to a flight attendant and have them moved you to a better seat. *PL",PL,"Nina, you can certainly reach out to a flight attendant and have them moved you to a better seat. "
Mon,Oct,12,2015,@bbachofner Enjoy your flight Brian! :-) *ML,@bbachofner  ,Enjoy your flight Brian! :-) *ML,ML,Enjoy your flight Brian! :-) 
Mon,Oct,12,2015,@LLeal101 Please follow/DM with your bag tag information and I'll take a look.  *ML,@LLeal101  ,Please follow/DM with your bag tag information and I'll take a look.  *ML,ML,Please follow/DM with your bag tag information and I'll take a look.  
Mon,Oct,12,2015,"@LLeal101 Liana, I'm sorry to hear that you are still waiting on your luggage.   *ML",@LLeal101  ,"Liana, I'm sorry to hear that you are still waiting on your luggage.   *ML",ML,"Liana, I'm sorry to hear that you are still waiting on your luggage.   "
Mon,Oct,12,2015,@silvercontactor Hello Mark. Not good to hear. Pls follow/DM the bag tag # for your privacy. Let me assist.  *RD,@silvercontactor  ,Hello Mark. Not good to hear. Pls follow/DM the bag tag # for your privacy. Let me assist.  *RD,RD,Hello Mark. Not good to hear. Pls follow/DM the bag tag # for your privacy. Let me assist.  
Mon,Oct,12,2015,@CassCakey Unfortunately I'm unable to view the link.   *ML,@CassCakey  ,Unfortunately I'm unable to view the link.   *ML,ML,Unfortunately I'm unable to view the link.   
Mon,Oct,12,2015,@CassCakey  Oh No Cassandra!  I'm sorry to hear your travel experience was not a pleasant one.  Please follow/DM your flt information. *ML,@CassCakey  , Oh No Cassandra!  I'm sorry to hear your travel experience was not a pleasant one.  Please follow/DM your flt information. *ML,ML, Oh No Cassandra!  I'm sorry to hear your travel experience was not a pleasant one.  Please follow/DM your flt information. 
Mon,Oct,12,2015,@flacindy Hello Cindy. Oh no! Very sorry for the delays. Pls DM your confirm # for your privacy.  *RD,@flacindy  ,Hello Cindy. Oh no! Very sorry for the delays. Pls DM your confirm # for your privacy.  *RD,RD,Hello Cindy. Oh no! Very sorry for the delays. Pls DM your confirm # for your privacy.  
